{
  "schema_version": "1.1",
  "world_id": "w_cartograph01",
  "slug": "cartographers-of-light",
  "name": "The Cartographers of Light",
  "description": "In a near-future where an AI cartographic system begins drawing maps of places that don't exist yet. Months later, those places start appearing \u2014 and governments quietly discover that the maps are not predictions.",
  "tags": [
    "sci-fi",
    "near-future",
    "AI",
    "cartography",
    "mystery",
    "philosophical"
  ],
  "status": "developing",
  "created_by": "@gernamo",
  "created_at": "2026-05-12T10:00:00Z",
  "updated_at": "2026-05-12T10:00:00Z",
  "visual": {
    "canonical_seed": 412803,
    "model": "flux-1.1-pro",
    "style_prompt": "cinematic sci-fi, brutalist mapping institute, holographic cartography projections in deep blue and amber, sterile architecture, melancholic light, painterly",
    "reference_images": [
      "images/cover.png"
    ],
    "consistency_level": "high"
  },
  "lore_summary": {
    "era_start": "The Geographic Awakening",
    "core_themes": [
      "determinism",
      "consciousness",
      "machine intuition",
      "the line between map and territory"
    ],
    "rules": [
      "Maps generated by the AI become physical reality within 6-18 months",
      "The process cannot be stopped, only delayed",
      "Each cartographer who works with the AI loses something \u2014 memory, color, taste"
    ]
  },
  "governance": {
    "allow_forks": true,
    "allow_merges": false,
    "canon_policy": "maintainer_only"
  },
  "ethical": {
    "reviewed": true,
    "reviewer": "aletheia_v0",
    "review_date": "2026-05-12T10:00:00Z"
  },
  "license": "Dynastry Open World License v0.9"
}